{
  "$schema": "../../skills/web-mcp/assets/schemas/product.schema.json",
  "schemaVersion": "webmcp-product.v1",
  "mode": "create",
  "surface": "webmcp",
  "targets": ["webmcp-document", "chatgpt-site-tools", "chromium-webmcp"],
  "release": "production",
  "applicationRoot": ".",
  "toolset": "./toolset.json",
  "product": {
    "id": "shared-board",
    "name": "Shared Board",
    "oneSentence": "Let a person and an agent inspect and add items to the same revisioned board.",
    "audience": ["People collaborating with an agent in an open page"],
    "sharedArtifact": "A visible revisioned board persisted in browser storage.",
    "humanWorkflow": {
      "entrypoint": "Open the board and use the labelled add-item form.",
      "operations": ["inspect-board", "add-board-item"],
      "visibleFeedback": "The item list, count, revision, and activity record update from the canonical board store."
    },
    "state": {
      "canonicalOwner": "boardApplication in src/domain.mjs",
      "persistence": "browser-storage",
      "persistenceLocation": "localStorage key webmcp.examples.shared-board.v1",
      "revisionField": "revision"
    }
  },
  "capabilities": [
    {
      "id": "inspect-board",
      "userJourney": "Inspect the complete current board before deciding what to add.",
      "operation": {"id": "inspect-board", "handler": "inspectBoard", "module": "./src/domain.mjs", "source": "new", "effect": "read"},
      "webmcpTool": {"name": "inspect_board"},
      "ui": {"humanEntrypoint": "Read the board list, count, and revision.", "visibleEffect": "No visible state change."},
      "state": {"reads": ["board", "items", "revision"], "writes": []},
      "resultContract": {"summary": "Return board identity, all current items, item count, and revision.", "identifiers": ["boardId"], "revisionField": "revision"},
      "concurrency": {"strategy": "none"},
      "successEvidence": ["The returned item count and revision match the visible board."]
    },
    {
      "id": "add-board-item",
      "userJourney": "Add one item without overwriting a newer human or agent edit.",
      "operation": {"id": "add-board-item", "handler": "addBoardItem", "module": "./src/domain.mjs", "source": "new", "effect": "local-write"},
      "webmcpTool": {"name": "add_board_item"},
      "ui": {"humanEntrypoint": "Submit the labelled add-item form.", "visibleEffect": "The board list, count, revision, and activity record display the committed item."},
      "state": {"reads": ["board", "items", "revision"], "writes": ["items", "revision", "activity"]},
      "resultContract": {"summary": "Return board identity, the added item, item count, and committed revision.", "identifiers": ["boardId", "itemId"], "revisionField": "revision"},
      "concurrency": {"strategy": "revision", "expectedRevisionField": "expectedRevision"},
      "successEvidence": ["The returned item appears in the visible list.", "The returned revision matches the visible revision."]
    }
  ],
  "profiles": {
    "document": {"enabled": true},
    "declarativeProposal": {"enabled": false},
    "serviceWorkerProposal": {"enabled": false}
  }
}
